{
  "$schema": "https://json-schema.org/draft/2020-12/schema",
  "$id": "https://maformac.local/schemas/local-receipt.schema.json",
  "title": "MAformac Local Receipt",
  "type": "object",
  "additionalProperties": false,
  "required": [
    "receipt_id",
    "created_at",
    "change_id",
    "proof_class",
    "base_commit",
    "head_commit",
    "dirty_worktree",
    "commands",
    "mechanical_gates",
    "claim_boundaries"
  ],
  "properties": {
    "receipt_id": { "type": "string", "minLength": 1 },
    "created_at": { "type": "string", "format": "date-time" },
    "change_id": { "type": "string", "minLength": 1 },
    "proof_class": {
      "type": "string",
      "enum": ["openspec_apply_local", "local_tests_only", "manual_review_evidence"]
    },
    "base_commit": { "type": "string", "pattern": "^[0-9a-f]{7,40}$" },
    "head_commit": { "type": "string", "pattern": "^[0-9a-f]{7,40}$" },
    "dirty_worktree": { "type": "boolean" },
    "commands": {
      "type": "array",
      "minItems": 1,
      "items": {
        "type": "object",
        "additionalProperties": false,
        "required": ["cmd", "exit_code", "verdict", "evidence_path", "sha256"],
        "properties": {
          "cmd": { "type": "string", "minLength": 1 },
          "exit_code": { "type": "integer" },
          "verdict": { "type": "string", "enum": ["pass", "fail", "blocked"] },
          "evidence_path": { "type": "string", "minLength": 1 },
          "sha256": { "type": "string", "pattern": "^[0-9a-f]{64}$" },
          "notes": { "type": "string" }
        }
      }
    },
    "mechanical_gates": {
      "type": "object",
      "additionalProperties": false,
      "required": ["default_scope_ssot", "c5_c2_parity", "scope_origin_single_source"],
      "properties": {
        "default_scope_ssot": { "type": "string", "enum": ["pass", "fail", "blocked"] },
        "c5_c2_parity": { "type": "string", "enum": ["pass", "fail", "blocked"] },
        "scope_origin_single_source": { "type": "string", "enum": ["pass", "fail", "blocked"] }
      }
    },
    "claim_boundaries": {
      "type": "array",
      "items": { "type": "string" },
      "contains": { "const": "no_training_no_c6_acceptance_no_golden_no_voice_no_uiue_merge" }
    }
  }
}
