{
  "receipt_id": "default-scope-apply-20260624T155654",
  "created_at": "2026-06-24T08:54:11Z",
  "change_id": "define-demo-default-scope",
  "proof_class": "openspec_apply_local",
  "base_commit": "14060bfc59db021024c39c068dadda00b38b7311",
  "head_commit": "d199609d7f08369b59b04397f365e539bb122cdd",
  "dirty_worktree": true,
  "commands": [
    {
      "cmd": "swift test --filter C3ContractLookupTests",
      "exit_code": 0,
      "verdict": "pass",
      "evidence_path": "Reports/default-scope-apply-20260624T155654/final_c3_contract.log",
      "sha256": "562135ee8c0284b28d7fc59ded196c5adbc5c2d6583d273ecca1ac0842543716",
      "notes": "C2 default_scope schema/parser validation focused test"
    },
    {
      "cmd": "swift test --filter C3ExecutionPipelineTests",
      "exit_code": 0,
      "verdict": "pass",
      "evidence_path": "Reports/default-scope-apply-20260624T155654/final_c3_pipeline.log",
      "sha256": "0fc832a174cb9ee67c2349f2596c22e9959f2b53a5dfccb125d02984f7b877bd",
      "notes": "C3 ScopeResolution and ScopeOrigin focused test"
    },
    {
      "cmd": "swift test --filter C3ReadbackTemplateTests",
      "exit_code": 0,
      "verdict": "pass",
      "evidence_path": "Reports/default-scope-apply-20260624T155654/final_c3_readback.log",
      "sha256": "09401811f1f68cd1004b711f00beb2fa0a32a574a7d59a3d7b0b7e1c88069f12",
      "notes": "Readback scope_origin focused test"
    },
    {
      "cmd": "swift test --filter ToolContractCompilerTests",
      "exit_code": 0,
      "verdict": "pass",
      "evidence_path": "Reports/default-scope-apply-20260624T155654/final_tool_contract.log",
      "sha256": "9c8e7b544860a973f94aca24c29625b3b4445bbba5d8238dee1b51cd728b35c5",
      "notes": "State applier default_scope focused test"
    },
    {
      "cmd": "swift test --filter C5LoRATrainingTests",
      "exit_code": 0,
      "verdict": "pass",
      "evidence_path": "Reports/default-scope-apply-20260624T155654/final_c5_lora.log",
      "sha256": "b9950fb383be62ed7db0546a586ff0e75b96a3fc206932f7e2964061584467fa",
      "notes": "C5/C2 scope parity focused test; no data generation or training"
    },
    {
      "cmd": "swift test --filter C6VehicleToolBenchTests",
      "exit_code": 0,
      "verdict": "pass",
      "evidence_path": "Reports/default-scope-apply-20260624T155654/final_c6_bench.log",
      "sha256": "f6c83f23621a0015ea8af6b5384910e0cb7521927f0853612fcbf1180bc1d333",
      "notes": "C6 default-scope gold fixture and scope_origin_evidence tests; not C6 acceptance"
    },
    {
      "cmd": "make verify-default-scope",
      "exit_code": 0,
      "verdict": "pass",
      "evidence_path": "Reports/default-scope-apply-20260624T155654/final_verify_default_scope.log",
      "sha256": "801b9f5cf0dc86533b55f847b356aa0d9d5cfa306ec1c369777feb570aefa008",
      "notes": "Three mechanical default-scope gates"
    },
    {
      "cmd": "swift run C6BenchCLI generate",
      "exit_code": 0,
      "verdict": "pass",
      "evidence_path": "Reports/default-scope-apply-20260624T155654/c6_generate_r1fix.log",
      "sha256": "b080253162ed23bfd1a1648d606fa24b4916dc36b711009c0bd5bb76d59cf9c8",
      "notes": "C6 JSONL regenerated from Core/Bench/C6VehicleToolBench.swift source"
    },
    {
      "cmd": "python3 scripts/migrate_c6_trap_to_d_domain.py --old-from-git",
      "exit_code": 0,
      "verdict": "pass",
      "evidence_path": "Reports/default-scope-apply-20260624T155654/c6_trap_migration_r1fix.log",
      "sha256": "cb601e90ca22c97193a46862ae9a6dfbeb9ad00d14ff3455134fb861434b9d19",
      "notes": "C6-TRAP cases restored via migration flow after source generation"
    },
    {
      "cmd": "make verify",
      "exit_code": 0,
      "verdict": "pass",
      "evidence_path": "Reports/default-scope-apply-20260624T155654/final_make_verify.log",
      "sha256": "1ed59c624d45e1b02fb148bb90dc4b5d8f66cd33244a5edb01abfd2fc7653c15",
      "notes": "Local project verify gate on clean tracked tree"
    },
    {
      "cmd": "make verify-all",
      "exit_code": 0,
      "verdict": "pass",
      "evidence_path": "Reports/default-scope-apply-20260624T155654/final_make_verify_all.log",
      "sha256": "c86588a5d4d6bba06ef5021c2938c88ad82fde3e021c2705cb8631411037ca6f",
      "notes": "Full local verify-all gate on clean tracked tree"
    },
    {
      "cmd": "openspec validate define-demo-default-scope --strict",
      "exit_code": 0,
      "verdict": "pass",
      "evidence_path": "Reports/default-scope-apply-20260624T155654/final_openspec_change.log",
      "sha256": "29b5d691b11038e9579f4f49b2b87aa9f8614ff838a5e1208a817887f7c27630",
      "notes": "OpenSpec change validation after apply tasks ledger update"
    },
    {
      "cmd": "openspec validate --all --strict",
      "exit_code": 0,
      "verdict": "pass",
      "evidence_path": "Reports/default-scope-apply-20260624T155654/final_openspec_all.log",
      "sha256": "25361f2f372668e94d814fc9606c1a1bfeb54683d0019b528adec08100335d35",
      "notes": "OpenSpec all validation after apply tasks ledger update"
    },
    {
      "cmd": "git diff --check",
      "exit_code": 0,
      "verdict": "pass",
      "evidence_path": "Reports/default-scope-apply-20260624T155654/final_git_diff_check.log",
      "sha256": "fa77ab6dcf895a30623113e37b6ee812c6cd35b0cbb9693a0c18de550e6b1cf6",
      "notes": "Whitespace diff check"
    }
  ],
  "mechanical_gates": {
    "default_scope_ssot": "pass",
    "c5_c2_parity": "pass",
    "scope_origin_single_source": "pass"
  },
  "claim_boundaries": [
    "no_training_no_c6_acceptance_no_golden_no_voice_no_uiue_merge",
    "no_lora_data_generation_or_training",
    "no_real_model_evaluation_or_d_domain_base_recalibration",
    "no_demo_golden_run_or_golden_id_freeze",
    "no_voice_asr_tts_readiness",
    "no_uiue_merge_no_uiue_file_line_mainline_proof",
    "r_l17_not_closed_by_this_receipt",
    "codex_claude_same_vendor_r_l17_precheck_only",
    "demo_scenarios_and_l1_allowlist_updated",
    "c6_jsonl_generated_from_core_bench_and_trap_migration",
    "scope_origin_evidence_recorded_in_c6_gold_and_eval_results",
    "external_research_artifacts_committed_separately_from_default_scope_apply"
  ]
}
